{
  "input_mode": "macro",
  "team": {
    "name": "Al-Hilal",
    "A1": 0.82,
    "A2": 0.55,
    "A3": 0.78,
    "A4": 0.75,
    "A5": 0.7,
    "A6": 0.72,
    "A7": 0.75,
    "A8": 0.8,
    "A9": 0.8,
    "A10": 0.65,
    "A11": 0.8,
    "A12": 0.82,
    "A13": 0.75,
    "A14": 0.78
  },
  "opponent": {
    "name": "Al-Najma",
    "A1": 0.5,
    "A2": 0.75,
    "A3": 0.55,
    "A4": 0.55,
    "A5": 0.45,
    "A6": 0.4,
    "A7": 0.7,
    "A8": 0.75,
    "A9": 0.65,
    "A10": 0.7,
    "A11": 0.72,
    "A12": 0.5,
    "A13": 0.65,
    "A14": 0.68
  },
  "scenarios": [
    {
      "id": "S3_min58",
      "label": "Espulsione L\u00e1zaro per condotta violenta (58'). Superiorit\u00e0 numerica 11v10, risultato 1-1. Opportunit\u00e0 tattica.",
      "match_conditions": {
        "time_remaining": 32,
        "score_diff": 0,
        "fatigue_level": 0.45,
        "morale": 0.7
      }
    }
  ],
  "config": {
    "opponent_penalty_lambda": 0.5,
    "top_n": 5
  }
}