{
  "input_mode": "macro",
  "team": {
    "name": "Al-Hilal",
    "A1": 0.75,
    "A2": 0.65,
    "A3": 0.8,
    "A4": 0.5,
    "A5": 0.42,
    "A6": 0.65,
    "A7": 0.72,
    "A8": 0.75,
    "A9": 0.78,
    "A10": 0.75,
    "A11": 0.7,
    "A12": 0.78,
    "A13": 0.62,
    "A14": 0.72
  },
  "opponent": {
    "name": "Al-Najma",
    "A1": 0.5,
    "A2": 0.75,
    "A3": 0.55,
    "A4": 0.55,
    "A5": 0.45,
    "A6": 0.4,
    "A7": 0.7,
    "A8": 0.75,
    "A9": 0.65,
    "A10": 0.7,
    "A11": 0.72,
    "A12": 0.5,
    "A13": 0.65,
    "A14": 0.68
  },
  "scenarios": [
    {
      "id": "S5_min85",
      "label": "Vantaggio 2-3 dopo gol Neves (78') e Al-Yami (82'). Al-Najma in 9 uomini (espulsione El Yamiq 76'). Gestione finale.",
      "match_conditions": {
        "time_remaining": 5,
        "score_diff": 2,
        "fatigue_level": 0.85,
        "morale": 0.9
      }
    }
  ],
  "config": {
    "opponent_penalty_lambda": 0.2,
    "top_n": 5
  }
}