{
  "input_mode": "macro",
  "team": {
    "name": "Al-Hilal",
    "A1": 0.82, "A2": 0.58, "A3": 0.78, "A4": 0.58,
    "A5": 0.50, "A6": 0.72, "A7": 0.72, "A8": 0.78,
    "A9": 0.80, "A10": 0.68, "A11": 0.62, "A12": 0.82,
    "A13": 0.72, "A14": 0.75
  },
  "opponent": {
    "name": "Al-Najma",
    "A1": 0.50, "A2": 0.75, "A3": 0.55, "A4": 0.55,
    "A5": 0.45, "A6": 0.40, "A7": 0.70, "A8": 0.75,
    "A9": 0.65, "A10": 0.70, "A11": 0.72, "A12": 0.50,
    "A13": 0.65, "A14": 0.68
  },
  "scenarios": [
    {
      "id": "S1_min03",
      "label": "Gol subito a freddo (1-0 Al-Najma, 3'). Difesa alta sorpresa, Lázaro segna da fuori area. Reazione immediata richiesta.",
      "match_conditions": {
        "time_remaining": 87,
        "score_diff": -1,
        "fatigue_level": 0.05,
        "morale": 0.40
      }
    },
    {
      "id": "S2_min10",
      "label": "Pareggio ristabilito (1-1, 10'). Costruzione manovrata contro 5-3-2, assist Al-Harbi per Al-Dawsari. Momentum positivo.",
      "match_conditions": {
        "time_remaining": 80,
        "score_diff": 0,
        "fatigue_level": 0.15,
        "morale": 0.80
      }
    },
    {
      "id": "S3_min58",
      "label": "Espulsione Lázaro per condotta violenta (58'). Superiorità numerica 11v10, risultato 1-1. Opportunità tattica.",
      "match_conditions": {
        "time_remaining": 32,
        "score_diff": 0,
        "fatigue_level": 0.58,
        "morale": 0.70
      }
    },
    {
      "id": "S4_min71",
      "label": "Pareggio 2-2 (71'). Theo Hernández segna dopo azione corale dalla zona di rifinitura. Gara riaperta dopo OG al 60'.",
      "match_conditions": {
        "time_remaining": 19,
        "score_diff": 0,
        "fatigue_level": 0.75,
        "morale": 0.60
      }
    },
    {
      "id": "S5_min85",
      "label": "Vantaggio 2-3 dopo gol Neves (78') e Al-Yami (82'). Al-Najma in 9 uomini (espulsione El Yamiq 76'). Gestione finale.",
      "match_conditions": {
        "time_remaining": 5,
        "score_diff": 2,
        "fatigue_level": 0.85,
        "morale": 0.90
      }
    }
  ],
  "config": {
    "opponent_penalty_lambda": 0.20,
    "top_n": 5
  }
}
