{
  "input_mode": "macro",
  "team": {
    "name": "Al-Hilal",
    "A1": 0.82,
    "A2": 0.58,
    "A3": 0.78,
    "A4": 0.58,
    "A5": 0.5,
    "A6": 0.72,
    "A7": 0.72,
    "A8": 0.78,
    "A9": 0.8,
    "A10": 0.68,
    "A11": 0.62,
    "A12": 0.82,
    "A13": 0.72,
    "A14": 0.75
  },
  "opponent": {
    "name": "Al-Najma",
    "A1": 0.5,
    "A2": 0.75,
    "A3": 0.55,
    "A4": 0.55,
    "A5": 0.45,
    "A6": 0.4,
    "A7": 0.7,
    "A8": 0.75,
    "A9": 0.65,
    "A10": 0.7,
    "A11": 0.72,
    "A12": 0.5,
    "A13": 0.65,
    "A14": 0.68
  },
  "scenarios": [
    {
      "id": "S2_min10",
      "label": "Pareggio ristabilito (1-1, 10'). Costruzione manovrata contro 5-3-2, assist Al-Harbi per Al-Dawsari. Momentum positivo.",
      "match_conditions": {
        "time_remaining": 80,
        "score_diff": 0,
        "fatigue_level": 0.15,
        "morale": 0.8
      }
    }
  ],
  "config": {
    "opponent_penalty_lambda": 0.2,
    "top_n": 5
  }
}